{"gameplayBootstrapRef":"worldkit://gameplay-bootstrap/g-bot-subject-world.8201@1","gravityMetersPerSecondSquaredXYZ":[0,-9.81,0],"id":"cloud-temple-t-gate-native-block-native","initialCamera":{"distanceMeters":5,"fovDegrees":56,"mode":"third-person","pitchRadians":0.18,"targetHeightMeters":1.2},"initialControlledEntityId":"g-bot-primary","kind":"babylon-native-scene-bootstrap","nativeSceneApiRef":"worldkit://native-scene-api/babylon@1","nativeSceneProfileRef":"worldkit://native-scene-profile/whitebox.blocks@1","sceneModuleRef":"worldkit://native-scene/cloud-temple-t-gate-native-block@1","schemaVersion":1,"seed":3639930443,"spawnMarkerId":"spawn-foreground-platform"}